subject,Question,A,B,C,D,answer,explanation,topic
iot,Which communication technology is most suitable for IoT devices in rural areas?,Bluetooth,Wi-Fi,LoRaWAN,USB,2,LoRaWAN supports long-range communication in low-power environments unlike Wi-Fi,communication
iot,What is the role of API in IoT systems?,Manual data entry,Enable communication between services,Store data,Encrypt messages,1,APIs allow integration between IoT components unlike storage or encryption systems,systems
iot,Which factor is critical for ensuring IoT scalability?,Limited devices,Efficient resource management,Fixed infrastructure,Manual control,1,Scalability depends on efficient resource handling unlike fixed systems,concepts
iot,Which IoT security principle ensures only authorized users access data?,Confidentiality,Authentication,Availability,Scalability,1,Authentication verifies identity unlike confidentiality which protects data,security
iot,What is the purpose of digital certificates in IoT?,Improve speed,Verify identity of devices,Store data,Reduce latency,1,Certificates authenticate devices preventing unauthorized access unlike performance features,security
iot,Which IoT application uses sensors to monitor soil moisture?,Smart healthcare,Smart agriculture,Smart city,Smart home,1,Smart agriculture uses sensors for crop management unlike healthcare systems,applications
iot,What is the main challenge of IoT interoperability?,Devices cannot store data,Devices use different standards and protocols,Devices lack sensors,Devices have low power,1,Different protocols hinder communication across devices unlike power or storage issues,concepts
iot,Which IoT component handles data aggregation before sending to cloud?,Sensor,Actuator,Gateway,Router,2,Gateway aggregates and processes data unlike sensors which only collect data,architecture
iot,Which metric is used to evaluate IoT network performance?,Latency,Font size,Screen resolution,Color depth,0,Latency measures delay in communication unlike visual attributes,performance
iot,What is the function of time synchronization in IoT systems?,Improve UI,Ensure consistent timestamps across devices,Increase storage,Reduce bandwidth,1,Synchronization ensures accurate event sequencing unlike UI or storage improvements,concepts
iot,Which protocol is commonly used for device-to-device communication in IoT?,MQTT,CoAP,Bluetooth,TCP,2,Bluetooth enables short-range device communication unlike MQTT which is broker-based,communication
iot,What is the role of machine learning in IoT?,Store data,Analyze patterns and make predictions,Manage UI,Encrypt data,1,ML extracts insights and predictions from IoT data unlike storage or encryption,applications
iot,Which IoT application monitors patient health remotely?,Smart grid,Remote patient monitoring,Smart farming,Traffic system,1,Healthcare IoT enables remote monitoring improving patient care unlike other domains,applications
iot,What is the main purpose of load balancing in IoT systems?,Reduce data,Distribute workload across servers,Store data,Encrypt data,1,Load balancing improves performance and availability unlike storage or encryption,performance
iot,Which factor impacts IoT device reliability?,Signal interference,Font style,Color scheme,Screen size,0,Interference affects communication reliability unlike UI elements,performance
iot,What is the role of blockchain in IoT?,Improve UI,Provide secure decentralized transactions,Reduce device count,Store images,1,Blockchain ensures secure tamper-proof transactions unlike UI or storage functions,security
iot,Which IoT application is used in smart energy systems?,Smart grid,Email system,Word processing,Social media,0,Smart grid optimizes energy usage using IoT unlike unrelated applications,applications
iot,What is the main purpose of sensor fusion in IoT?,Combine multiple sensor data for accuracy,Store data,Reduce devices,Increase latency,0,Sensor fusion improves accuracy by combining inputs unlike storage or latency increase,concepts
iot,Which factor is critical for real-time IoT systems?,High latency,Low latency,Large storage,Complex UI,1,Real-time systems require minimal delay unlike high latency systems,performance
iot,What is edge analytics?,Processing data at cloud,Processing data near source devices,Storing data offline,Manual analysis,1,Edge analytics reduces latency and bandwidth unlike cloud-only processing,architecture
iot,Which IoT system monitors traffic flow in cities?,Smart home,Smart city traffic system,Smart agriculture,Healthcare system,1,Traffic monitoring improves urban mobility unlike other domains,applications
iot,What is the main function of sensors in IoT?,Act on data,Collect environmental data,Store data,Transmit data only,1,Sensors gather real-world inputs unlike actuators which act on data,components
iot,Which IoT communication model involves direct request-response interaction?,MQTT,CoAP,Bluetooth,TCP,1,CoAP follows REST request-response unlike MQTT pub-sub model,protocols
iot,What is the purpose of redundancy in IoT systems?,Reduce cost,Improve reliability,Increase latency,Reduce performance,1,Redundancy ensures system continues functioning despite failures unlike reducing cost or performance,architecture
iot,Which IoT application is used for smart transportation?,Traffic monitoring system,Word processor,Email service,Calculator,0,IoT improves traffic efficiency unlike unrelated tools,applications
iot,What is the main advantage of 5G in IoT?,Low speed,High latency,High speed and low latency,Limited coverage,2,5G enables fast reliable communication unlike older networks,communication
iot,Which IoT concept refers to connecting everyday objects to internet?,Cloud computing,Internet of Things,Big data,Artificial intelligence,1,IoT connects physical objects enabling communication unlike other concepts,basics
iot,What is the function of gateway in IoT architecture?,Store UI,Translate protocols and connect networks,Act as sensor,Replace devices,1,Gateway enables communication across heterogeneous networks unlike sensors,architecture
subject,Question,A,B,C,D,answer,explanation,topic
iot,An IoT deployment in a hospital requires ultra-reliable low-latency communication for critical devices. Which network technology is most suitable?,Wi-Fi,4G LTE,5G URLLC,Bluetooth,2,5G URLLC provides ultra-reliable low latency communication required for critical healthcare unlike Wi-Fi or Bluetooth which lack reliability guarantees,communication
iot,A large-scale IoT system experiences bottlenecks due to centralized processing. What is the best solution?,Increase database size,Adopt edge or fog computing,Reduce number of devices,Disable sensors,1,Edge or fog computing distributes processing reducing bottlenecks unlike simply increasing storage or disabling devices,architecture
iot,Which protocol is best suited for asynchronous communication in IoT systems?,HTTP,MQTT,FTP,SMTP,1,MQTT uses publish subscribe model enabling asynchronous communication unlike HTTP request-response,protocols
iot,What is the primary purpose of device provisioning in IoT?,Replace devices,Register and configure devices securely,Store data,Improve UI,1,Provisioning ensures secure onboarding of devices unlike replacement or UI improvement,security
iot,Which layer of IoT architecture is responsible for business logic and decision making?,Perception layer,Network layer,Application layer,Business layer,3,Business layer handles analytics and decision making unlike lower layers focused on data collection and transmission,architecture
iot,Which factor is most critical in selecting IoT communication protocol?,Color scheme,Power consumption and bandwidth requirements,Font size,Screen resolution,1,Protocol selection depends on power and bandwidth constraints unlike visual factors,communication
iot,What is the key advantage of using IPv6 in IoT?,Limited addressing,Large address space for devices,Lower security,Reduced connectivity,1,IPv6 provides vast address space supporting billions of devices unlike IPv4 limitations,networking
iot,Which IoT concept ensures data consistency across distributed devices?,Latency,Synchronization,Compression,Caching,1,Synchronization ensures consistent timestamps and data alignment unlike compression or caching,concepts
iot,Which IoT system uses actuators to control irrigation automatically?,Smart healthcare,Smart agriculture irrigation system,Smart grid,Smart lighting,1,Smart irrigation uses sensors and actuators for automated watering unlike healthcare or lighting systems,applications
iot,What is the role of middleware in IoT systems?,Replace sensors,Provide communication and data management services,Act as actuator,Store UI elements,1,Middleware enables integration between devices and applications unlike hardware components,architecture
iot,Which metric measures the efficiency of data transmission in IoT?,Latency,Throughput,Resolution,Brightness,1,Throughput measures data transfer rate unlike latency which measures delay,performance
iot,Which IoT security attack involves intercepting communication between devices?,Replay attack,Man-in-the-middle attack,DoS attack,Phishing,1,MITM intercepts communication altering data unlike replay or phishing attacks,security
iot,What is the purpose of firmware updates in IoT devices?,Change UI,Fix bugs and improve security,Increase device size,Reduce connectivity,1,Firmware updates patch vulnerabilities and improve performance unlike UI changes,security
iot,Which IoT application uses sensors to detect air pollution levels?,Smart home,Environmental monitoring system,Smart grid,Healthcare system,1,Environmental monitoring tracks pollution using sensors unlike unrelated applications,applications
iot,What is the key challenge in IoT data management?,Unlimited storage,Handling large volume and velocity of data,No data generation,Simple processing,1,IoT generates massive data requiring efficient processing unlike assumptions of limited data,cloud
iot,Which communication model is used in REST-based IoT protocols?,Publish-subscribe,Request-response,Broadcast only,Peer-to-peer only,1,REST uses request-response interaction unlike MQTT pub-sub model,protocols
iot,What is the role of encryption in IoT systems?,Reduce latency,Protect data confidentiality,Increase storage,Improve UI,1,Encryption secures data against unauthorized access unlike performance improvements,security
iot,Which IoT component processes data locally before sending to cloud?,Sensor,Actuator,Edge device,Router,2,Edge devices perform local processing reducing latency unlike sensors or routers,architecture
iot,What is the purpose of load balancing in IoT cloud systems?,Reduce devices,Distribute workload evenly,Store data,Encrypt communication,1,Load balancing ensures efficient resource utilization unlike storage or encryption,performance
iot,Which IoT application is used in logistics tracking?,Smart home,Fleet tracking system,Word processor,Calculator,1,Fleet tracking uses IoT sensors to monitor vehicle location unlike unrelated applications,applications
iot,What is the main advantage of fog computing?,Centralized processing,Reduced latency and bandwidth usage,Unlimited storage,Manual control,1,Fog computing processes data closer to source unlike centralized cloud systems,architecture
iot,Which IoT protocol is designed for high reliability messaging?,UDP,MQTT with QoS,FTP,HTTP,1,MQTT QoS ensures message delivery guarantees unlike UDP which is unreliable,protocols
iot,What is the purpose of digital twin technology?,Store data,Create virtual replica of physical system,Encrypt communication,Manage UI,1,Digital twin simulates real system for monitoring and optimization unlike storage or UI systems,concepts
iot,Which IoT system monitors structural health of buildings?,Smart agriculture,Structural monitoring system,Smart grid,Healthcare system,1,Structural monitoring uses sensors to detect stress and damage unlike agriculture or healthcare,applications
iot,What is the key benefit of distributed IoT architecture?,Single point of failure,Improved fault tolerance and scalability,Reduced connectivity,Limited devices,1,Distributed systems improve resilience unlike centralized systems,architecture
iot,Which factor affects IoT device connectivity?,Signal strength and interference,Font size,Color theme,Screen brightness,0,Connectivity depends on signal quality unlike visual attributes,performance
iot,What is the role of AI in IoT?,Store data,Analyze patterns and automate decisions,Improve UI,Reduce devices,1,AI enables intelligent automation unlike storage or UI functions,applications
iot,Which IoT application is used for smart energy management?,Smart grid system,Word processor,Email service,Calculator,0,Smart grid optimizes energy usage using IoT unlike unrelated tools,applications
iot,What is the purpose of redundancy in IoT systems?,Reduce cost,Ensure reliability during failures,Increase latency,Reduce performance,1,Redundancy prevents system failure unlike cost reduction strategies,architecture
iot,Which IoT protocol is suitable for low latency communication?,HTTP,MQTT,TCP,SMTP,1,MQTT is lightweight enabling faster communication unlike HTTP or SMTP,protocols
iot,What is the role of sensors in IoT systems?,Act on data,Collect environmental data,Store data,Transmit only,1,Sensors gather data unlike actuators which act on it,components
iot,Which IoT system is used for traffic congestion management?,Smart city traffic system,Smart home system,Healthcare system,Education system,0,Traffic systems use sensors for real-time monitoring unlike other domains,applications
iot,What is the purpose of time-series analysis in IoT?,Analyze sequential data over time,Store images,Encrypt data,Manage UI,0,Time-series analysis handles temporal data unlike storage or UI tasks,analytics
iot,Which IoT communication technology is best for high-speed data transfer?,Zigbee,Wi-Fi,LoRaWAN,NFC,1,Wi-Fi provides high data rates unlike Zigbee or LoRaWAN which are low power,communication
iot,What is the role of gateway in IoT?,Translate protocols and connect devices,Act as sensor,Store UI,Replace cloud,0,Gateway bridges different protocols unlike sensors or UI components,architecture
iot,Which IoT concept refers to seamless integration of devices?,Interoperability,Latency,Throughput,Caching,0,Interoperability allows devices to work together unlike performance metrics,concepts
iot,What is the primary goal of IoT analytics?,Store data,Extract insights and predictions,Reduce devices,Improve UI,1,Analytics converts raw data into actionable insights unlike storage or UI,cloud
iot,Which factor impacts IoT latency most?,Network delay,Font style,Color scheme,Screen size,0,Latency depends on network delay unlike visual attributes,performance
iot,What is the function of actuator in IoT?,Collect data,Perform action,Store data,Transmit data,1,Actuators execute commands unlike sensors which collect data,components
iot,Which IoT system monitors patient vitals remotely?,Remote patient monitoring system,Smart grid,Traffic system,Education system,0,Healthcare IoT enables remote monitoring unlike other domains,applications
iot,What is the role of blockchain in IoT?,Provide decentralized secure transactions,Improve UI,Reduce devices,Store images,0,Blockchain ensures secure tamper-proof data exchange unlike UI or storage,security
iot,Which IoT architecture layer handles data communication?,Perception layer,Network layer,Application layer,Business layer,1,Network layer manages communication unlike perception which collects data,architecture
iot,What is the advantage of MQTT over HTTP?,Lower overhead and bandwidth usage,Higher complexity,More storage usage,Better UI design,0,MQTT is lightweight unlike HTTP which has higher overhead,protocols
iot,Which IoT application is used in smart homes?,Automated lighting system,Word processor,Email service,Calculator,0,Smart homes use IoT for automation unlike unrelated applications,applications
iot,What is the role of cloud in IoT?,Store and analyze data,Collect data,Act as sensor,Replace devices,0,Cloud handles storage and analytics unlike sensors or devices,cloud
subject,Question,A,B,C,D,answer,explanation,topic
cg,Which component is primarily responsible for rendering graphics efficiently?,CPU,RAM,GPU,Cache,2,GPU handles parallel processing for rendering images unlike CPU which is optimized for general tasks,hardware
cg,What does a frame buffer store in a graphics system?,Program instructions,Pixel color values,User input,Audio signals,1,Frame buffer holds pixel data to be displayed on screen unlike instructions or inputs,basics
cg,Which algorithm is widely used for efficient line drawing?,DDA algorithm,Bresenham algorithm,Floyd algorithm,Prim algorithm,1,Bresenham uses integer calculations making it faster than DDA which uses floating point operations,algorithms
cg,What is the purpose of clipping in computer graphics?,Increase resolution,Remove invisible portions,Add colors,Rotate objects,1,Clipping removes parts outside viewing region unlike transformations that modify shape,algorithms
cg,Which transformation changes the size of an object?,Translation,Rotation,Scaling,Reflection,2,Scaling alters dimensions while translation moves and rotation reorients object,transformations
cg,Which transformation shifts an object’s position without altering shape?,Scaling,Rotation,Translation,Shearing,2,Translation changes position only unlike scaling or rotation,transformations
cg,Which transformation rotates an object around a fixed point?,Translation,Scaling,Rotation,Reflection,2,Rotation changes orientation around pivot unlike translation or scaling,transformations
cg,Which algorithm is used for drawing circles efficiently?,DDA,Bresenham circle algorithm,DFS algorithm,Bubble sort,1,Bresenham circle uses symmetry reducing computations unlike DDA,algorithms
cg,What is resolution in graphics?,Number of colors,Number of pixels displayed,Refresh rate,Memory size,1,Resolution refers to pixel count affecting image clarity unlike refresh rate,basics
cg,What is raster graphics?,Mathematical shapes,Pixel-based images,3D models,Vector lines,1,Raster graphics use pixels unlike vector graphics which use equations,basics
cg,What is vector graphics?,Pixel-based images,Mathematical representation of shapes,Bitmap images,3D only images,1,Vector graphics scale without loss unlike raster images,basics
cg,Which device is used to display graphical output?,Keyboard,Mouse,Monitor,Scanner,2,Monitor is output device unlike keyboard or mouse which are input devices,hardware
cg,What is aliasing in graphics?,Smooth edges,Jagged edges effect,Color mixing,Scaling error,1,Aliasing creates jagged edges due to insufficient resolution unlike smoothing techniques,basics
cg,Which technique reduces jagged edges in graphics?,Clipping,Anti-aliasing,Scaling,Reflection,1,Anti-aliasing smooths edges by blending pixels unlike clipping,basics
cg,What is a viewport?,Input device,Display area for output,Memory unit,Processing unit,1,Viewport defines visible area of scene unlike hardware components,basics
cg,Which coordinate system is used for screen display?,World coordinates,Device coordinates,Polar coordinates,Spherical coordinates,1,Device coordinates map to screen pixels unlike world coordinates,basics
cg,What is the purpose of transformation matrices?,Store data,Apply geometric transformations,Render images,Process input,1,Matrices are used for transformations like rotation and scaling unlike storage,transformations
cg,Which transformation preserves shape but changes orientation?,Scaling,Translation,Rotation,Shearing,2,Rotation maintains shape while changing orientation unlike scaling,transformations
cg,What is shearing transformation?,Rotation,Distortion along axis,Scaling uniformly,Translation,1,Shearing skews object unlike rotation or scaling,transformations
cg,Which algorithm is used for polygon filling?,Flood fill algorithm,Binary search,Merge sort,DFS algorithm,0,Flood fill fills connected regions unlike sorting algorithms,algorithms
cg,What is z-buffer used for?,Color mixing,Hidden surface removal,Line drawing,Scaling objects,1,Z-buffer determines visible surfaces based on depth unlike coloring techniques,algorithms
cg,Which technique determines visible surfaces in 3D graphics?,Clipping,Hidden surface removal,Scaling,Translation,1,Hidden surface removal ensures only visible parts are rendered unlike clipping,algorithms
cg,What is perspective projection?,Parallel projection,Objects appear smaller with distance,Scaling transformation,Rotation method,1,Perspective projection mimics human vision unlike parallel projection,projection
cg,Which projection keeps object size constant regardless of distance?,Perspective projection,Parallel projection,Scaling projection,Reflection projection,1,Parallel projection maintains size unlike perspective projection,projection
cg,What is shading in computer graphics?,Removing objects,Adding color and lighting effects,Scaling shapes,Translating objects,1,Shading enhances realism using light effects unlike transformations,rendering
cg,Which shading technique produces smooth color transitions?,Flat shading,Gouraud shading,Wireframe shading,Point shading,1,Gouraud interpolates vertex colors unlike flat shading which uses single color,rendering
cg,What is ray tracing used for?,Line drawing,Realistic rendering with light simulation,Clipping,Scaling,1,Ray tracing simulates light paths for realism unlike simple rendering,rendering
cg,What is the purpose of texture mapping?,Increase resolution,Apply surface details,Remove edges,Scale objects,1,Texture mapping adds realism by applying images onto surfaces unlike scaling,rendering
cg,Which transformation flips an object across an axis?,Translation,Reflection,Scaling,Rotation,1,Reflection mirrors object unlike translation or rotation,transformations
cg,What is interpolation in graphics?,Removing data,Estimating intermediate values,Scaling objects,Clipping,1,Interpolation calculates intermediate values for smooth rendering unlike removal,rendering
subject,Question,A,B,C,D,answer,explanation,topic
cg,Which buffer technique is used to handle visibility in 3D scenes efficiently?,Frame buffer,Depth buffer,Stencil buffer,Color buffer,1,Depth buffer stores z-values to determine visible surfaces unlike frame buffer which stores colors,algorithms
cg,What is the primary purpose of double buffering?,Increase resolution,Reduce flickering,Improve color depth,Increase memory size,1,Double buffering uses two buffers to avoid flickering unlike single buffer rendering,rendering
cg,Which coordinate system represents objects before projection?,Device coordinates,World coordinates,Screen coordinates,Pixel coordinates,1,World coordinates define object positions before mapping to screen unlike device coordinates,basics
cg,What is the purpose of homogeneous coordinates?,Simplify transformations using matrices,Increase resolution,Store colors,Improve speed only,0,Homogeneous coordinates allow unified matrix operations for transformations unlike basic coordinate systems,transformations
cg,Which algorithm is used for hidden surface removal in real-time graphics?,DDA algorithm,Z-buffer algorithm,Bresenham algorithm,Scan-line algorithm,1,Z-buffer efficiently determines visible surfaces unlike line drawing algorithms,algorithms
cg,What is the role of scan-line algorithm?,Sort data,Fill polygons efficiently,Rotate objects,Scale objects,1,Scan-line fills polygons by processing horizontal lines unlike transformation operations,algorithms
cg,Which transformation changes the shape of an object without preserving angles?,Scaling,Rotation,Shearing,Translation,2,Shearing distorts shape unlike rotation or translation which preserve structure,transformations
cg,What is back-face culling used for?,Color shading,Removing invisible surfaces facing away from viewer,Scaling objects,Drawing lines,1,Back-face culling improves performance by ignoring hidden surfaces unlike shading techniques,rendering
cg,Which shading technique computes lighting per pixel for higher realism?,Flat shading,Gouraud shading,Phong shading,Wireframe shading,2,Phong shading calculates lighting per pixel producing smoother results unlike Gouraud,rendering
cg,What is the purpose of clipping window?,Define visible region,Store pixels,Rotate objects,Scale images,0,Clipping window defines area to display unlike storage or transformation operations,algorithms
cg,Which projection type is used in engineering drawings?,Perspective projection,Parallel projection,Oblique projection,Orthographic projection,3,Orthographic projection maintains true dimensions unlike perspective projection,projection
cg,What is the main advantage of perspective projection?,Maintains size accuracy,Realistic depth perception,Reduces computation,Eliminates clipping,1,Perspective projection mimics human vision unlike parallel projection,projection
cg,Which technique is used to smooth curves in graphics?,Interpolation,Clipping,Translation,Reflection,0,Interpolation generates smooth transitions unlike transformations,rendering
cg,What is rasterization?,Converting vector graphics into pixels,Scaling objects,Rotating objects,Clipping objects,0,Rasterization converts geometric data into pixel representation unlike transformations,rendering
cg,Which algorithm is used for filling irregular shapes?,Flood fill algorithm,Binary search,Merge sort,Heap sort,0,Flood fill fills connected regions unlike searching or sorting algorithms,algorithms
cg,What is the function of viewport transformation?,Map world coordinates to screen coordinates,Store data,Rotate objects,Clip objects,0,Viewport maps coordinates to display area unlike storage or rotation,transformations
cg,Which method is used for realistic lighting effects?,Ray tracing,Line drawing,Scaling,Clipping,0,Ray tracing simulates light paths unlike simple rendering techniques,rendering
